{
  "v": 1,
  "id": "carrow-coast-loop-2027",
  "title": "The Carrow coast loop",
  "destination": "Isle of Carrow",
  "country": "Fictional Isles",
  "timezone": "Etc/GMT+3",
  "locale": "en-US",
  "start_date": "2027-06-08",
  "end_date": "2027-06-11",
  "travelers": [
    "Traveller One",
    "Traveller Two"
  ],
  "pace": "relaxed",
  "day_start": "09:00",
  "day_end": "18:30",
  "lodging": [
    {
      "id": "brackenford-inn",
      "name": "Brackenford Inn",
      "place_id": "FixtureDlBrackenfordInn",
      "lat": 41.2,
      "lng": -40.5,
      "address": "2 Mill Street, Brackenford, Isle of Carrow, Fictional Isles",
      "from": "2027-06-08",
      "to": "2027-06-10",
      "check_in": "15:00",
      "check_out": "10:30",
      "note": "Nights 1–2 (town A)."
    },
    {
      "id": "gullhaven-lodge",
      "name": "Gullhaven Lodge",
      "place_id": "FixtureDlGullhavenLodge",
      "lat": 41.42,
      "lng": -40.18,
      "address": "Harbour Road, Gullhaven, Isle of Carrow, Fictional Isles",
      "from": "2027-06-10",
      "to": "2027-06-11",
      "check_in": "16:00",
      "check_out": "10:00",
      "note": "Night 3 (town B)."
    },
    {
      "id": "marrow-bay-hotel",
      "name": "Marrow Bay Hotel",
      "place_id": "FixtureDlMarrowBayHotel",
      "lat": 41.15,
      "lng": -39.9,
      "address": "1 Strand, Marrow Bay, Isle of Carrow, Fictional Isles",
      "from": "2027-06-11",
      "to": "2027-06-12",
      "check_in": "15:00",
      "check_out": "11:00",
      "note": "Night 4 (town C)."
    }
  ],
  "modes": {
    "default": "DRIVE",
    "allowed": [
      "DRIVE",
      "WALK"
    ]
  },
  "budget_notes": "Hire car for four days; fuel and the lighthouse entry are the only other costs (fixture).",
  "status": "intake",
  "intro": "An invented island for testing: a four-day driving loop from Brackenford north to Gullhaven and south to Marrow Bay, with a ridge hike, a cliff-top overlook and two small villages.",
  "practical": [
    {
      "title": "Driving",
      "text": "Single-track roads north of Tollby; allow extra time and use passing places.",
      "items": [
        {
          "label": "Car hire",
          "text": "Collect and return in Brackenford.",
          "url": "https://carhire.example.com/carrow"
        },
        "Fuel in Brackenford, Gullhaven and Marrow Bay only."
      ]
    },
    {
      "title": "Good to know",
      "items": [
        "Gullhaven Lighthouse is closed on Mondays and Thursdays.",
        "The north cape is a separate day trip."
      ]
    }
  ]
}
